Keyword,Date,Product Name,Price,Page
drinks,2020-11-12,"Zevia Zero Calorie Energy Drink, Variety Pack, 12 Ounce Cans (Pack of 12)",$19.99,2
drinks,2020-11-12,"Fairlife Core Power Elite High Protein Shake 42g, Vanilla, Ready To Drink for Workout Recovery, 14 FL Oz Bottles 12 Pack",$39.36,2
drinks,2020-11-12,"Red Bull Red Bull Energy Drink, 6 Pack of 8.4 Fl Oz",$9.69,2
drinks,2020-11-12,"Rockstar Energy Drink Pure Zero, Grape, 24 Count",$36.00,2
drinks,2020-11-12,"BODYARMOR LYTE Sports Drink Low-Calorie Sports Beverage, Peach Mango, Natural Flavors With Vitamins, Potassium-Packed Electrolytes, No Preservatives, Perfect For Athletes, 16 Fl Oz (Pack of 12)",$13.44,2
drinks,2020-11-12,"Do or Drink - Party Card Game - for College, Camping, 21st Birthday, Parties - Funny for Men & Women",$29.99,2
drinks,2020-11-12,"Truth or Drink - Fun Drinking Card Game for Adults, Great for Parties and Game Night",$35.00,2
drinks,2020-11-12,"Organic Clean Energy Drink by RUNA, Variety Pack | Refreshing Tea Taste | 10 Calories | Powerful Natural Caffeine | Healthy Energy & Focus | No Crash or Jitters | 12 Oz (Pack of 12)",$29.88,2
drinks,2020-11-12,"Organic Clean Energy Drink by RUNA, Sampler Pack | Refreshing Tea Taste | 10 Calories | Powerful Natural Caffeine | Healthy Energy & Focus | No Crash or Jitters | 12 Oz (Pack of 6)",$20.00,2
drinks,2020-11-12,"Organic Clean Energy Drink by RUNA, Variety Pack | Refreshing Tea Taste | 10 Calories | Powerful Natural Caffeine | Healthy Energy & Focus | No Crash or Jitters | 12 Oz (Pack of 12)",$29.88,3
drinks,2020-11-12,"Neuro SLEEP Peach Apricot, 14.5 Fl Oz (Pack of 12)",$29.99,3
drinks,2020-11-12,"Bing Beverage Company Bing Cherry, 12- Fl. Oz (Pack of 24)",$44.95,3
drinks,2020-11-12,"Rockstar Energy Drink, Recovery Lemonade, 16 Fl Oz (Pack of 24)",$28.32,3
drinks,2020-11-12,Good Drinks: Alcohol-Free Recipes for When You're Not Drinking for Whatever Reason,$20.69,3
drinks,2020-11-12,"VPX Redline Xtreme, Watermelon, 8 Ounce Bottles, 24 Count",$62.57,3
drinks,2020-11-12,"Premier Protein Clear Protein Drink, Tropical Punch, 16.9 fl oz Bottle, (12 Count)",$27.49,3
drinks,2020-11-12,"SKRATCH LABS Sport Hydration Drink Mix, Lemon Lime (46.5 oz, 60 servings) - Natural, Electrolyte Powder Developed for Athletes and Sports Performance, Gluten Free, Vegan, Kosher",$49.00,3
drinks,2020-11-12,"BOOST Original Complete Nutritional Drink, Rich Chocolate, 8 Ounce Bottle (Pack of 24)",$26.52,3
drinks,2020-11-12,Drink: The Intimate Relationship Between Women and Alcohol,$16.99,3
drinks,2020-11-12,"V8 Sparkling +Energy, Healthy Energy Drink, Natural Energy from Tea, Lemon Lime, 11.5 Ounce Can",$15.15,3
drinks,2020-11-12,"V8 +Energy Variety Pack, Healthy Energy Drink, Black Cherry and Pomegranate Blueberry, 8 Ounce Can (4 Packs of 6, Total of 24)",$22.26,3
drinks,2020-11-12,"Buddeez Party Top New Beverage Dispenser, 1.75 gallon, Clear",$14.88,3
drinks,2020-11-12,"CELSIUS HEAT Performance Energy Drink 6-Flavor Variety Pack, Zero Sugar, 16oz. Can (Pack of 12)",$24.00,3
drinks,2020-11-12,Drink,$0,3
drinks,2020-11-12,"Sparkling Ice, Black Raspberry Sparkling Water, with Antioxidants and Vitamins, Zero Sugar, 17 fl oz Bottles (Pack of 12)",$9.98,3
drinks,2020-11-12,"Core Power fairlife Core Power High Protein Milk Shake, Strawberry Banana, 14 Fl Oz (Pack of 12)",$32.16,3
drinks,2020-11-12,"Sambazon Amazon Energy Drink, Low Calorie Acai Berry and Pomegranate, 12 Fl Oz (Pack of 12)",$21.23,3
drinks,2020-11-12,"Core Power fairlife Core Power High Protein Milk Shake, Vanilla, 14 Fl Oz (Pack of 12)",$29.88,3
drinks,2020-11-12,"CELSIUS Sweetened with Stevia Sparkling Grapefruit Fitness Drink, Zero Sugar, 12oz. Slim Can (Pack of 12)",$20.04,3
drinks,2020-11-12,"Organic Clean Energy Drink by RUNA, Berry | Refreshing Tea Taste | 10 Calories | Powerful Natural Caffeine | Healthy Energy & Focus | No Crash or Jitters | 8.4 oz (Pack of 24)",$37.99,3
drinks,2020-11-12,"Perrier Pink Grapefruit Flavored Carbonated Mineral Water, 8.45 Fl Oz (30 Pack) Slim Cans",$22.88,3
drinks,2020-11-12,"Organic Clean Energy Drink by RUNA, Berry | Refreshing Tea Taste | 10 Calories | Powerful Natural Caffeine | Healthy Energy & Focus | No Crash or Jitters | 8.4 oz (Pack of 24)",$37.99,1
drinks,2020-11-12,"Bing Beverage Company Bing Black, 12 Fl Oz (Pack of 24)",$44.95,1
drinks,2020-11-12,"Monster Energy Ultra Sunrise, Sugar Free Energy Drink, 16 Ounce (Pack of 24)",$33.98,1
drinks,2020-11-12,"CELSIUS Fitness Drink Variety Pack, Zero Sugar, 12oz. Slim Can (Pack of 12)",$23.99,1
drinks,2020-11-12,"Reign Total Body Fuel, Orange Dreamsicle, Fitness & Performance Drink, 16 Fl Oz (Pack of 12)",$18.98,1
drinks,2020-11-12,"Monster Energy Drink, Green, Original, 16 Ounce (Pack of 24)",$33.99,1
drinks,2020-11-12,"BODYARMOR Sports Drink Sports Beverage, Fruit Punch, Natural Flavors With Vitamins, Potassium-Packed Electrolytes, No Preservatives, Perfect For Athletes, 16 Fl Oz (Pack of 12)",$11.96,1
drinks,2020-11-12,"V8 +Energy, Healthy Energy Drink, Natural Energy from Tea, Peach Mango, 8 Ounce Can (4 Packs of 6, Total of 24)",$14.96,1
drinks,2020-11-12,"Monster Rehab Tea + Lemonade + Energy, Energy Iced Tea, 15.5 Ounce (Pack of 24)",$38.49,1
drinks,2020-11-12,"Bai Flavored Water, Rainforest Variety Pack, Antioxidant Infused Drinks, 18 Fluid Ounce Bottles, 12 Count, 3 Each of Brasilia Blueberry, Costa Rica Clementine, Malawi Mango, Sumatra Dragonfruit",$17.14,1
drinks,2020-11-12,"V8 Sparkling +Energy, Healthy Energy Drink, Natural Energy from Tea, Lemon Lime, 11.5 Ounce Can",$15.15,1
drinks,2020-11-12,"V8 +Energy Variety Pack, Healthy Energy Drink, Black Cherry and Pomegranate Blueberry, 8 Ounce Can (4 Packs of 6, Total of 24)",$22.26,1
drinks,2020-11-12,"Bai Coconut Flavored Water, Cocofusions Variety Pack II, 18 Fluid Ounce Bottles, 12 Count, 3 each of Andes Coconut Lime, Madagascar Coconut Mango, Molokai Coconut, Puna Coconut Pineapple",$15.94,1
drinks,2020-11-12,"Monster Energy Zero Sugar, Low Calorie Energy Drink, 16 Ounce (Pack of 24)",$45.99,1
drinks,2020-11-12,"Rockstar Energy Drink Pure Zero Energy Drink, Punched, 16 Fluid Ounce (Pack of 24) (6930010)",$27.00,1
drinks,2020-11-12,"Fairlife Core Power High Protein Milk Shake, Chocolate, 14 FL Oz Pack of 12",$30.23,1
drinks,2020-11-12,"VPX Bang Radical Skadattle Energy Drink, 0 Calories, Sugar Free with Super Creatine, 16 Fl Oz (Pack of 12)",$23.76,1
drinks,2020-11-12,"Core Power Elite High Protein Shakes (42g), chocolate, Ready to Drink for Workout Recovery, 14 fl oz Bottles (12 Pack)",$35.88,1
drinks,2020-11-12,"CELSIUS Cranberry Lemon On-the-Go Powder Stick Packs, Zero Sugar (14 Sticks per Pack)",$11.96,1
drinks,2020-11-12,"Monster Energy, Lo-Carb Monster, Low Carb Energy Drink, 16 Ounce (Pack of 24)",$38.49,1
drinks,2020-11-12,"Perrier Pink Grapefruit Flavored Carbonated Mineral Water, 8.45 Fl Oz (30 Pack) Slim Cans",$22.88,1
drinks,2020-11-12,"Neuro SLEEP Peach Apricot, 14.5 Fl Oz (Pack of 12)",$29.99,1
water,2020-11-12,"Icelandic Glacial Natural Spring Alkaline Water, 16.9 Fl Oz (Pack of 24)",$32.93,1
water,2020-11-12,"No1 Botanicals Sparkling Rosemary Water – subtle and refreshing, sparkling botanical water. No sugars, sweeteners or preservatives – healthy, luxurious drinks containing 20 calories per bottle (12x330ml)",$45.00,1
water,2020-11-12,"Essentia Water, Ionized Alkaline Bottled Water; Electrolytes for Taste, Ionized Hydration, pH 9.5 or Higher, 33.8 Fl Oz, Pack of 12",$19.89,1
water,2020-11-12,"evian Natural Spring Water, Naturally Filtered Spring Water in Large Bottles, 33.81 Fl Oz (Pack of 12)",$15.93,1
water,2020-11-12,"Fiji Natural Artesian Water, 16.9 Fl Oz",$27.96,1
water,2020-11-12,"Zico Natural 100% Coconut Water Drink, No Sugar Added Gluten Free, 16.9 Fl Oz, 12 Pack",$18.49,1
water,2020-11-12,"CORE Hydration, 30.4 Fl. Oz (Pack of 12), Nutrient Enhanced Water, Perfect 7.4 Natural pH, Ultra-Purified With Electrolytes and Minerals, Cup Cap For Sharing",$15.00,1
water,2020-11-12,"Fiji Natural Artesian Water, 50.7 Fl Oz",$34.68,1
water,2020-11-12,"Perrier Carbonated Mineral Water, 16.9 Fl Oz (24 Pack) Plastic Bottles",$14.83,1
water,2020-11-12,"Nestlé Pure Life Bottled Purified Water, 16.9 oz. Bottles, 24/Case",$0,1
water,2020-11-12,"Flow Alkaline Spring Water, Organic Watermelon + Lime, 100% Natural Alkaline Water pH 8.1, Electrolytes + Essential Minerals, Eco-Friendly Pack, 100% Recyclable, BPA-Free, Non-GMO, Pack of 12 x 500ml",$14.99,1
water,2020-11-12,"VOSS Artesian Still Water, 500 ml Plastic Bottles (Pack of 24)",$30.09,1
water,2020-11-12,"POLAND SPRING 100% Natural Spring Water, 16.9 oz Plastic Bottles (Pack of 24)",$5.99,1
water,2020-11-12,Water For Elephants,$3.99,1
water,2020-11-12,"Deer Park  (24 Pack) 100% Natural Spring Water, 16.9-ounce plastic bottles",$0,1
water,2020-11-12,"Ice Mountain Brand Natural Spring Water,16.9 Fl Oz (24 Pack)",$0,1
water,2020-11-12,"Crystal Geyser, Alpine Spring Water, 128 Fl Oz",$1.49,1
water,2020-11-12,GE RPWFE Refrigerator Water Filter,$43.48,1
water,2020-11-12,"EveryDrop by Whirlpool Refrigerator Water Filter 1, EDR1RXD1 (Pack of 1)",$39.11,1
water,2020-11-12,"EveryDrop by Whirlpool Refrigerator Water Filter 2, EDR2RXD1 (Pack of 1)",$39.39,1
water,2020-11-12,"JUST Water, Premium Pure Still Spring Water in an Eco-Friendly BPA Free Plant-Based Bottle - Naturally Alkaline, High 8.0 pH - Fully Recyclable Boxed Water Carton, 11.2 Fluid Ounces (Pack of 24)",$29.49,1
water,2020-11-12,Aqua Carpatica Natural Spring Water (500ml) - 24 Pack,$34.93,1
water,2020-11-12,"Icelandic Glacial Natural Spring Alkaline Water, 16.9 Fl Oz (Pack of 24)",$32.93,2
water,2020-11-12,"No1 Botanicals Sparkling Rosemary Water – subtle and refreshing, sparkling botanical water. No sugars, sweeteners or preservatives – healthy, luxurious drinks containing 20 calories per bottle (12x330ml)",$45.00,2
water,2020-11-12,"Waterpik WP-660 Water Flosser Electric Dental Countertop Professional Oral Irrigator For Teeth, Aquarius,White",$68.14,2
water,2020-11-12,"ZeroWater 5-Stage Replacement Filter, 2-Pack, White",$0,2
water,2020-11-12,"GE RPWFE Refrigerator Water Filter, White Green, Pack of 2",$96.95,2
water,2020-11-12,"Brio Self Cleaning Bottom Loading Water Cooler Water Dispenser – Limited Edition - 3 Temperature Settings - Hot, Cold & Cool Water - UL/Energy Star Approved",$249.99,2
water,2020-11-12,"Frigidaire EPTWFU01 Refrigerator Water Filter, 1 Count, White",$42.65,2
water,2020-11-12,Camco 25ft TASTEPure Heated Drinking Water Hose with Energy Saving Thermostat - Lead and BPA Free (22911),$85.09,2
water,2020-11-12,Samsung HAF-CIN/EXP Refrigerator Water Filter 1 Pack (Packaging may vary),$36.99,2
water,2020-11-12,"EveryDrop by Whirlpool Refrigerator Water Filter 3, EDR3RXD1 (Pack of 1),White",$47.84,2
water,2020-11-12,"Flow Alkaline Spring Water, Organic Watermelon + Lime, 100% Natural Alkaline Water pH 8.1, Electrolytes + Essential Minerals, Eco-Friendly Pack, 100% Recyclable, BPA-Free, Non-GMO, Pack of 12 x 500ml",$14.99,2
water,2020-11-12,"VOSS Artesian Still Water, 500 ml Plastic Bottles (Pack of 24)",$30.09,2
water,2020-11-12,"Frigidaire WF3CB Puresource Replacement Filter, 1-Pack, 1 Count, White",$36.03,2
water,2020-11-12,"Frigidaire ULTRAWF Pure Source Ultra Water Filter, Original, White, 1 Count",$45.00,2
water,2020-11-12,"WaterWipes Unscented Baby Wipes, Sensitive and Newborn Skin, 9 Packs (540 Wipes)",$26.63,2
water,2020-11-12,"Propel, Berry, Zero Calorie Sports Drinking Water with Electrolytes and Vitamins C&E, 16.9 Fl Oz (12 Count)",$6.38,2
water,2020-11-12,"Bosch Electric Mini-Tank Water Heater Tronic 3000 T 4-Gallon (ES4) - Eliminate Time for Hot Water - Shelf, Wall or Floor Mounted",$151.99,2
water,2020-11-12,"LG LT1000P - 6 Month / 200 Gallon Capacity Replacement Refrigerator Water Filter (NSF42, NSF53, and NSF401) ADQ74793501, ADQ75795105, or AGF80300704",$49.00,2
water,2020-11-12,GIRARD 2GWHAM Tankless Water Heater,$518.33,2
water,2020-11-12,General Electric MWF Refrigerator Water Filter,$46.80,2
water,2020-11-12,Natural Mineral Alkaline Water ph8+ Bioavailable Fulvic & Humic Acid Extract Concentrate Has Over 77 Trace Minerals blk Water Helps Repair & Restore Cells & Essential Minerals in Your Body 16.9oz 12pk,$27.00,2
water,2020-11-12,"Trimino Protein Infused Water, 6-Flavor Variety Pack, 16 Ounce (Pack of 24)",$42.99,2
water,2020-11-12,"Flow Alkaline Spring Water, Organic Watermelon + Lime, 100% Natural Alkaline Water pH 8.1, Electrolytes + Essential Minerals, Eco-Friendly Pack, 100% Recyclable, BPA-Free, Non-GMO, Pack of 12 x 500ml",$14.99,3
water,2020-11-12,"No1 Botanicals Sparkling Rosemary Water – subtle and refreshing, sparkling botanical water. No sugars, sweeteners or preservatives – healthy, luxurious drinks containing 20 calories per bottle (12x330ml)",$45.00,3
water,2020-11-12,"PUR Water Pitcher Replacement Filter with Lead Reduction, 3 Pack, Blue",$20.98,3
water,2020-11-12,"Avalon Bottom Loading Water Cooler Water Dispenser - 3 Temperature Settings - Hot, Cold & Room Water, Durable Stainless Steel Construction - UL/Energy Star Approved",$192.29,3
water,2020-11-12,"evian Natural Spring Water 500 mL/16.9 Fl Oz (Pack of 24), Naturally Filtered Spring Water in Individual-Sized Plastic Bottles",$23.92,3
water,2020-11-12,"FIJI Natural Artesian Water, 33.8 Fl Oz (Pack of 12)",$21.36,3
water,2020-11-12,"S.Pellegrino Sparkling Natural Mineral Water, 33.8 Fl Oz. (12 Pack)",$19.96,3
water,2020-11-12,"Acqua Panna Natural Spring Water, 16.9 Fl. Oz. Plastic Bottles, Pack of 24",$19.96,3
water,2020-11-12,"Shurflo 2088-554-144 Fresh Water Pump, 12 Volts, 3.5 Gallons Per Minute, 45 Psi",$68.50,3
water,2020-11-12,"Vita Coco Coconut Water, Pure Organic | Refreshing Coconut Taste | Natural Electrolytes | Vital Nutrients | 11.1 Oz (Pack Of 12)",$18.99,3
water,2020-11-12,"Icelandic Glacial Natural Spring Alkaline Water, 16.9 Fl Oz (Pack of 24)",$32.93,3
water,2020-11-12,"VOSS Artesian Still Water, 500 ml Plastic Bottles (Pack of 24)",$30.09,3
water,2020-11-12,"Be Water, My Friend: The Teachings of Bruce Lee",$22.18,3
water,2020-11-12,"Whirlpool WHESFC Pro Series – Softener/Whole Home Filter Hybrid, Gray",$590.75,3
water,2020-11-12,"LifeStraw Personal Water Filter for Hiking, Camping, Travel, and Emergency Preparedness",$17.35,3
water,2020-11-12,"Water Flosser Professional Cordless Dental Oral Irrigator - 300ML Portable and Rechargeable IPX7 Waterproof 3 Modes Water Flosser with Cleanable Water Tank for Home and Travel, Braces & Bridges Care",$37.99,3
water,2020-11-12,"Waterpik Cordless Water Flosser Rechargeable Portable Oral irrigator for Travel & Home – Cordless Advanced, Wp-560 White",$69.97,3
water,2020-11-12,Watts Premier Instant Hot Water Recirculating Pump System with Built-In Timer,$199.00,3
water,2020-11-12,"Perrier Carbonated Mineral Water, 16.9 Fl Oz (24 Pack) Plastic Bottles",$14.83,3
water,2020-11-12,Malibu C Hard Water Wellness Hair Remedy,$3.70,3
water,2020-11-12,"Alkazone Antioxidant Alkaline Bottled Water l Enhanced with Antioxidants l Purified Water with Electrolytes Added for Taste l pH Balanced to 9.5 l 16.9 oz, (Pack of 24)",$44.22,3
water,2020-11-12,"Trimino Protein Infused Water, 6-Flavor Variety Pack, 16 Ounce (Pack of 24)",$42.99,3
